{
  "id": "c8b46b52-0846-4abb-ba56-b484064f84ac",
  "gbl_mdVersion_s": "Aardvark",
  "dct_title_s": "Anglesey; Garnesay; Wight olim vectis; Iarsay; Per Gerardum Mercatorem.; Title on verso: Isles d'Anglesey Wight Jarsay et Garnesay",
  "dct_description_sm": [
    "Relief shown pictorially. Each map is 15 x 21 cm. Does not match any states listed in Van der Krogt. From the Appendix Atlas of the British Isles and Northern Europe, title created to represent a unique collection within the Clark Library, University of Michigan. 4 maps on one sheet: 30 x 43 cm."
  ],
  "dct_language_sm": ["eng"],
  "dct_creator_sm": [
    "Hondius, Hendrik, 1597-1651. Appendix Atlas of the British Isles and Northern Europe",
    "Jansson, Jan, 1588-1664. Appendix Atlas of the British Isles and Northern Europe",
    "Mercator, Gerhard, 1512-1594",
    "Vignaud, Henry, 1830-1922, former owner."
  ],
  "schema_provider_s": "University of Michigan",
  "gbl_resourceClass_sm": ["Maps"],
  "dcat_keyword_sm": ["Clark Library Map Collections", "2022-creator-sprint"],
  "dct_temporal_sm": ["between 1630 and 1639"],
  "gbl_indexYear_im": [1630],
  "gbl_dateRange_drsim": ["[1630 TO 1639]"],
  "dct_spatial_sm": ["Isle of Wight", "Guernsey (Isle)", "Jersey (Isle)", "Anglesey (Isle)", "England", "Wales"],
  "locn_geometry": "MULTIPOLYGON(((-4.7 53.44, -4.02 53.44, -4.02 53.13, -4.7 53.13, -4.7 53.44)),((-1.591789 50.767556, -1.062732 50.767556, -1.062732 50.574678, -1.591789 50.574678, -1.591789 50.767556)),((-2.6825 49.5351, -2.3117 49.5351, -2.3117 49.3851, -2.6825 49.3851, -2.6825 49.5351)),((-2.2649 49.2775, -1.9958 49.2775, -1.9958 49.1411, -2.2649 49.1411, -2.2649 49.2775)),((-5.1707 54.5534, -3.9654 54.5534, -3.9654 53.845, -5.1707 53.845, -5.1707 54.5534)))",
  "dcat_bbox": "ENVELOPE(-4.98,-1.04,54.47,49.14)",
  "dcat_centroid": "51.805,-3.0100000000000002",
  "pcdm_memberOf_sm": ["64bd8c4c-8e60-4956-b43d-bdc3f93db488"],
  "dct_isPartOf_sm": ["07d-01"],
  "dct_rights_sm": ["This map is in the public domain."],
  "dct_rightsHolder_sm": [
    "Please attribute access and use of this digitized map to the Stephen S. Clark Library, University of Michigan Library. https://www.lib.umich.edu/about-us/policies/copyright-policy"
  ],
  "dct_accessRights_s": "Public",
  "dct_format_s": "JPEG",
  "dct_references_s": "{\"http://schema.org/url\":\"https://quod.lib.umich.edu/c/clark1ic/x-010356232/39015091191992_01\",\"http://iiif.io/api/presentation#manifest\":\"https://quod.lib.umich.edu/cgi/i/image/api/search/clark1ic:010356232\"}",
  "dct_identifier_sm": ["c8b46b52-0846-4abb-ba56-b484064f84ac"]
}
