{
  "dct_title_s": "A new & accurate map of Asia: drawn from actual surveys, and otherwise collected from journals; assisted by the most approved modern maps & charts. the whole being regulated by astron. observations",
  "dct_alternative_sm": ["iiif-eastern-hemisphere"],
  "dct_description_sm": [
    "Eastern hemisphere scanned map with IIIF manifest. ",
    "Cartographic Details: Scale [1:26,000,000]. Numbered \"N⁰52.\" Decorative title cartouche with palm tree. Shows boundaries, rivers, islands and principal settlements. Relief shown pictorially. London meridian. 35 x 43 cm"
  ],
  "dct_language_sm": ["eng"],
  "dct_creator_sm": ["Bowen, Emanuel (-1767)"],
  "schema_provider_s": "University of Minnesota",
  "gbl_resourceClass_sm": ["Maps"],
  "dcat_keyword_sm": ["GBL Fixture records"],
  "dct_temporal_sm": ["1750"],
  "gbl_indexYear_im": [1750],
  "gbl_dateRange_drsim": ["[1750 TO 1750]"],
  "locn_geometry": "MULTIPOLYGON (((-180 81.66,-168.35 81.66,-168.35 -12.93, -180 -12.93, -180 81.66),(25 81.66,25 -12.93,180 -12.93,180 81.66, 25 81.66)))",
  "dcat_bbox": "ENVELOPE(25,-168.35,81.66,-12.93)",
  "dcat_centroid": "34.365,-71.675",
  "dct_accessRights_s": "Public",
  "dct_format_s": "JPEG",
  "dct_references_s": "{\"http://schema.org/downloadUrl\":\"https://umedia.lib.umn.edu/sites/default/files/archive/113/image/tiff/1058396.tif\",\"http://schema.org/url\":\"http://purl.umn.edu/200804\",\"http://iiif.io/api/presentation#manifest\":\"https://cdm16022.contentdm.oclc.org/iiif/info/p16022coll246/224/manifest.json\"}",
  "id": "57f0f116-b64e-4773-8684-96ba09afb549",
  "dct_identifier_sm": ["57f0f116-b64e-4773-8684-96ba09afb549"],
  "gbl_mdModified_dt": "2021-06-01T22:14:16Z",
  "gbl_mdVersion_s": "Aardvark"
}
