{
  "dct_identifier_sm": ["6f47b103-9955-4bbe-a364-387039623106"],
  "dct_title_s": "Quaternary Fault and Fold Database of the United States (XYZ)",
  "dct_description_sm": ["Quaternary Fault and Fold Database of the United States"],
  "dct_accessRights_s": "Public",
  "schema_provider_s": "Stanford",
  "dct_references_s": "{\"http://schema.org/url\":\"https://www.usgs.gov/natural-hazards/earthquake-hazards/faults\",\"https://wiki.openstreetmap.org/wiki/Slippy_map_tilenames\":\"https://earthquake.usgs.gov/basemap/tiles/faults/{z}/{x}/{y}.png\",\"http://schema.org/downloadUrl\":\"https://earthquake.usgs.gov/static/lfs/nshm/qfaults/Qfaults_GIS.zip\"}",
  "id": "6f47b103-9955-4bbe-a364-387039623106-xyz",
  "gbl_resourceClass_sm": ["Datasets", "Web services"],
  "gbl_resourceType_sm": ["Line data"],
  "dct_format_s": "Shapefile",
  "dct_language_sm": ["eng"],
  "dct_publisher_sm": ["Geological Survey (U.S.)"],
  "dct_subject_sm": ["Earthquakes", "Faults"],
  "dct_issued_s": "2020",
  "gbl_indexYear_im": [2020],
  "dct_temporal_sm": ["2020"],
  "dct_spatial_sm": ["Earth (Planet)", "North America"],
  "locn_geometry": "ENVELOPE(-156.02, -70.80, 65.59, 18.93)",
  "dcat_bbox": "ENVELOPE(-156.02, -70.80, 65.59, 18.93)",
  "gbl_mdModified_dt": "2021-06-11T17:55:01Z",
  "gbl_mdVersion_s": "Aardvark"
}
