{
  "gbl_mdVersion_s": "Aardvark",
  "dct_identifier_sm": ["ark:/99999/fk4544658v"],
  "id": "princeton-fk4544658v-tilejson",
  "dct_title_s": "The Balkans [and] Turkey : G.S.G.S. no. 2097 / War Office. General Staff. Geographical Section (TileJSON Fixture)",
  "locn_geometry": "ENVELOPE(19.333333, 29.333333, 43.083333, 39.75)",
  "dcat_bbox": "ENVELOPE(19.333333, 29.333333, 43.083333, 39.75)",
  "schema_provider_s": "Princeton",
  "dct_accessRights_s": "Public",
  "dct_description_sm": [
    "Relief shown by contours approximately 100 feet interval, spot heights, and shading. Title varies; some sheets are titled \"Turkey\". Shows international boundaries, railways, 2 categories of roads, telegraph lines, places of worship, ruins. Constantinople latest edition map has a glossary."
  ],
  "dct_creator_sm": ["Great Britain. War Office. General Staff. Geographical Section"],
  "dct_language_sm": ["eng"],
  "dct_publisher_sm": ["[London] : War Office. General Staff. Geographical Section. General Staff, 1908-25."],
  "dct_subject_sm": ["Balkan Peninsula Maps", "Turkey Maps", "Topographic Maps"],
  "dct_spatial_sm": ["Balkan Peninsula", "Turkey"],
  "dct_issued_s": "1908",
  "gbl_indexYear_im": [1908],
  "gbl_mdModified_dt": "2022-02-03T22:13:40Z",
  "dct_references_s": "{\"http://schema.org/url\":\"https://catalog.princeton.edu/catalog/99125413918506421\",\"http://schema.org/thumbnailUrl\":\"https://figgy-staging.princeton.edu/downloads/6b55d939-7188-4bce-9550-0ac535441f22/file/9042b887-da2e-4aa9-9ca5-d3ba77f440c4\",\"http://iiif.io/api/image\":\"https://iiif-cloud-staging.princeton.edu/iiif/2/05%2F71%2F04%2F0571046f9c7149a3b950899323f70788%2Fintermediate_file/info.json\",\"http://iiif.io/api/presentation#manifest\":\"https://figgy-staging.princeton.edu/concern/scanned_maps/2a91d82c-541c-426c-b787-cc62afe8f248/manifest\",\"https://wiki.openstreetmap.org/wiki/Slippy_map_tilenames\":\"https://map-tiles-staging.princeton.edu/mosaicjson/tiles/2a91d82c541c426cb787cc62afe8f248/WebMercatorQuad/{z}/{x}/{y}@1x.png\",\"https://github.com/mapbox/tilejson-spec\":\"https://map-tiles-staging.princeton.edu/2a91d82c541c426cb787cc62afe8f248/mosaicjson/tilejson.json\"}",
  "gbl_resourceClass_sm": ["Maps", "Web services"],
  "gbl_resourceType_sm": ["Military maps", "Topographic maps"]
}
