{
  "dct_title_s": "University of Minnesota Digital Conservancy DRUM",
  "dct_alternative_sm": ["no_locn_geometry"],
  "dct_description_sm": [
    "This is a collection level record without spatial coordinates or a Geometry Type (GBL Metadata 1.0). ",
    "DRUM is a publicly available collection of digital research data generated by University of Minnesota researchers, students, and staff. Anyone can search and download the data housed in the repository, instantly or by request."
  ],
  "dct_publisher_sm": ["University of Minnesota Digital Conservancy"],
  "schema_provider_s": "University of Minnesota",
  "gbl_resourceClass_sm": ["Collections"],
  "dcat_keyword_sm": ["GBL Fixture records"],
  "dct_accessRights_s": "Public",
  "dct_references_s": "{\"http://schema.org/url\":\"https://conservancy.umn.edu/handle/11299/166578\"}",
  "id": "05d-03-noGeomType",
  "gbl_mdModified_dt": "2021-06-11T18:36:48Z",
  "gbl_mdVersion_s": "Aardvark"
}
