{
  "dct_title_s": "1994 General Plan Land Use Designations, Stanislaus County, California, 2014",
  "dct_alternative_sm": ["public_polygon"],
  "dct_description_sm": ["Polygon shapefile with WMS and WFS, and no metadata reference"],
  "dct_creator_sm": ["Stanislaus County (Calif.). Planning Department"],
  "dct_publisher_sm": ["Stanislaus County (Calif.)"],
  "schema_provider_s": "University of California Berkeley",
  "gbl_resourceClass_sm": ["Datasets"],
  "gbl_resourceType_sm": ["Polygon data", "Vector data"],
  "dct_subject_sm": ["Land Use", "Land Use Mapping"],
  "dcat_keyword_sm": ["GBL Fixture records"],
  "dct_temporal_sm": ["2014"],
  "dct_issued_s": "2014-10-22",
  "gbl_indexYear_im": [2014],
  "gbl_dateRange_drsim": ["[2014 TO 2014]"],
  "dct_spatial_sm": ["Stanislaus County (Calif.)", "California"],
  "locn_geometry": "ENVELOPE(-121.495138,-120.387591,38.07778,37.132488)",
  "dcat_bbox": "ENVELOPE(-121.495138,-120.387591,38.07778,37.132488)",
  "dcat_centroid": "37.605134,-120.9413645",
  "dct_accessRights_s": "Public",
  "dct_format_s": "Shapefile",
  "gbl_wxsIdentifier_s": "s7pq31",
  "dct_references_s": "{\"http://www.opengis.net/def/serviceType/ogc/wfs\":\"https://geoservices.lib.berkeley.edu/geoserver/wfs\",\"http://www.opengis.net/def/serviceType/ogc/wms\":\"https://geoservices.lib.berkeley.edu/geoserver/wms\"}",
  "id": "berkeley-s7pq31",
  "dct_identifier_sm": ["https://spatial.lib.berkeley.edu/viewpublic/berkeley-s7pq31"],
  "gbl_mdModified_dt": "2018-02-23T23:34:35Z",
  "gbl_mdVersion_s": "Aardvark"
}
