{
  "dct_title_s": "Wabash Aerial (17): Illinois, 1938",
  "dct_description_sm": [
    "One sheet of the 1938 aerial photography of Wabash County, Illinois, part of the statewide Illinois Historical Aerial Photography collection acquired between 1937 and 1947 and digitized by the Illinois State Geological Survey from the original photographic paper prints."
  ],
  "dct_language_sm": ["eng"],
  "schema_provider_s": "University of Illinois Urbana-Champaign",
  "dct_publisher_sm": ["Illinois State Geological Survey"],
  "gbl_resourceClass_sm": ["Imagery"],
  "dcat_theme_sm": ["Imagery"],
  "dcat_keyword_sm": ["Aerial photographs", "Historical imagery"],
  "dct_temporal_sm": ["1938"],
  "gbl_indexYear_im": [1938],
  "gbl_dateRange_drsim": ["[1938 TO 1938]"],
  "dct_spatial_sm": ["Illinois", "Wabash County, Illinois"],
  "locn_geometry": "ENVELOPE(-88.0094,-87.8104,38.4118,38.2158)",
  "dcat_bbox": "ENVELOPE(-88.0094,-87.8104,38.4118,38.2158)",
  "dcat_centroid": "38.3138,-87.90990",
  "pcdm_memberOf_sm": ["dc8c18df-7d64-4ff4-a754-d18d0891187d"],
  "dct_isPartOf_sm": ["09d-01", "eee6150b-ce2f-4837-9d17-ce72a0c1c26f"],
  "dct_accessRights_s": "Public",
  "dct_format_s": "GeoTIFF",
  "dct_references_s": "{\"http://schema.org/downloadUrl\":\"https://data.isgs.illinois.edu/arcgis/rest/services/Imagery/IL_Wabash_1938/ImageServer/exportImage?bbox=-88.0094,38.2158,-87.8104,38.4118&bboxSR=4326&imageSR=3857&size=2000,2000&format=tiff&f=image\",\"urn:x-esri:serviceType:ArcGIS#ImageMapLayer\":\"https://data.isgs.illinois.edu/arcgis/rest/services/Imagery/IL_Wabash_1938/ImageServer\",\"http://schema.org/url\":\"https://clearinghouse.isgs.illinois.edu/data/imagery/1937-1947-illinois-historical-aerial-photography\"}",
  "id": "33ecd1bd-c532-422c-8996-d8c1800aed5b",
  "dct_identifier_sm": ["33ecd1bd-c532-422c-8996-d8c1800aed5b"],
  "gbl_mdModified_dt": "2026-08-31T00:00:00Z",
  "gbl_mdVersion_s": "Aardvark"
}
