{
  "dct_title_s": "Princeton, Mercer County, New Jersey (Sheet 4)",
  "dct_alternative_sm": ["princeton-child4"],
  "dct_description_sm": [
    "Child record for testing the gbl_suppressed_b property. ",
    "Title taken from sheet 1 of 1927 map. \"Feb. 1885.\" Includes location map and key. Oriented with the north to the upper left."
  ],
  "dct_language_sm": ["eng"],
  "dct_creator_sm": ["Sanborn Map Company"],
  "dct_publisher_sm": ["New York : Sanborn Map & Publishing Co., Limited, 1885."],
  "schema_provider_s": "Princeton",
  "gbl_resourceClass_sm": ["Maps"],
  "dct_subject_sm": ["Real property-New Jersey-Princeton-Maps", "Princeton (N.J.)-Maps"],
  "dcat_keyword_sm": ["GBL Fixture records"],
  "locn_geometry": "ENVELOPE(-74.68,-74.63,40.37,40.33)",
  "dcat_bbox": "ENVELOPE(-74.68,-74.63,40.37,40.33)",
  "dcat_centroid": "40.349999999999994,-74.655",
  "dct_source_sm": ["princeton-1r66j405w"],
  "dct_accessRights_s": "Public",
  "dct_format_s": "TIFF",
  "gbl_wxsIdentifier_s": "public-figgy:p-b6ba3091-fcf4-4d2d-9d6a-df7df5c8c589",
  "dct_references_s": "{\"http://schema.org/downloadUrl\":\"https://figgy.princeton.edu/downloads/b6ba3091-fcf4-4d2d-9d6a-df7df5c8c588/file/ff89fcc8-e61b-4b27-938f-a03e63d4f5f1\",\"http://iiif.io/api/image\":\"https://libimages1.princeton.edu/loris/figgy_prod/5a%2F20%2F58%2F5a20585db50d44959fe5ae44821fd174%2Fintermediate_file.jp2/info.json\",\"http://schema.org/url\":\"https://catalog.princeton.edu/catalog/4266648\",\"http://iiif.io/api/presentation#manifest\":\"https://figgy.princeton.edu/concern/scanned_maps/2806e4cf-effc-4827-b116-952dfe776d14/manifest\"}",
  "id": "princeton-n009w382v-fake2",
  "dct_identifier_sm": ["ark:/88435/n009w382v", "HMC04 (Princeton)"],
  "gbl_mdModified_dt": "2021-06-01T22:14:16Z",
  "gbl_mdVersion_s": "Aardvark",
  "gbl_suppressed_b": true
}
