{
  "dct_title_s": "2015 New York City Subway Complexes and Ridership",
  "dct_alternative_sm": ["baruch_documentation_download"],
  "dct_description_sm": [
    "Point dataset with WMS and WFS, documentation download, and two parent records. ",
    "The subway complexes layer was created to represent ridership data for the NYC subway system (Metropolitan Transportation Authority, or MTA). This layer is a subset of the subway stations layer (nyu_2451_34503) that has been combined with MTA statistics on ridership; it was originally created in August 2012 and has been updated annually. Ridership data is not available for each individual subway station, as many stations are linked via common entrances and passageways where transfers are free, and because ridership data is not collected for the Staten Island Railway stations. This layer was created by choosing an individual station from nyu_2451_34503 to represent the entire complex, and modifying the station name and train fields appropriately. It should be used for mapping ridership data or for analysis that requires this data, and not for specifying actual station locations or measuring distances. There are 421 complexes, and the field station_ct indicates how many stations are part of a complex. Annual, average weekday, and average weekend ridership is provided for 2007 to 2014. The unique ID is complex_id, which was created by alphabetizing the complexes by borough and station name and assigning a sequential number to a borough prefix. This layer does not include the new 34th St - 11 Av station on the 7 line; it will be updated in summer 2016 once ridership data becomes available. This layer was created as part of the NYC Geodatabase (NYC GDB) project, a resource designed for basic geographic analysis and thematic mapping within the five boroughs of New York City."
  ],
  "dct_language_sm": ["eng"],
  "dct_creator_sm": ["GIS Lab, Newman Library, Baruch CUNY"],
  "dct_publisher_sm": ["Newman Library (Bernard M. Baruch College)"],
  "schema_provider_s": "Baruch CUNY",
  "gbl_resourceClass_sm": ["Datasets"],
  "gbl_resourceType_sm": ["Point data"],
  "dct_subject_sm": ["Subway stations", "Urban transportation", "Local transit", "Commuting"],
  "dcat_theme_sm": ["Transportation"],
  "dcat_keyword_sm": ["GBL Fixture records"],
  "dct_temporal_sm": ["2015"],
  "dct_issued_s": "2016-01-15",
  "gbl_indexYear_im": [2015],
  "gbl_dateRange_drsim": ["[2015 TO 2015]"],
  "dct_spatial_sm": [
    "New York, New York",
    "Bronx County, New York",
    "Kings County, New York",
    "New York County, New York",
    "Queens County, New York",
    "Borough of Bronx, New York",
    "Borough of Brooklyn, New York",
    "Borough of Manhattan, New York",
    "Borough of Queens, New York"
  ],
  "locn_geometry": "ENVELOPE(-74.030876,-73.755405,40.903125,40.576127)",
  "dcat_centroid": "40.739626,-73.8931405",
  "dct_source_sm": ["nyu_2451_34635", "nyu_2451_34636"],
  "dct_accessRights_s": "Public",
  "dct_format_s": "Shapefile",
  "gbl_wxsIdentifier_s": "sdr:nyu_2451_34502",
  "dct_references_s": "{\"http://lccn.loc.gov/sh85035852\":\"https://archive.nyu.edu/retrieve/74755/nyu_2451_34502_doc.zip\",\"http://schema.org/downloadUrl\":\"https://archive.nyu.edu/retrieve/74701/nyu_2451_34502.zip\",\"http://schema.org/url\":\"http://hdl.handle.net/2451/34502\",\"http://www.isotc211.org/schemas/2005/gmd/\":\"http://metadata.geo.nyu.edu/records/edu.nyu/handle/2451/34502/iso19139.xml\",\"http://www.opengis.net/def/serviceType/ogc/wfs\":\"https://maps-public.geo.nyu.edu/geoserver/sdr/wfs\",\"http://www.opengis.net/def/serviceType/ogc/wms\":\"https://maps-public.geo.nyu.edu/geoserver/sdr/wms\"}",
  "id": "nyu_2451_34502",
  "dct_identifier_sm": ["http://hdl.handle.net/2451/34502"],
  "gbl_mdModified_dt": "2021-06-01T22:14:15Z",
  "gbl_mdVersion_s": "Aardvark"
}
