{
  "dct_creator_sm": [
    "East View Geospatial"
  ],
  "dct_description_sm": [
    "This line dataset shows the road network in Port-au-Prince, Haiti, consisting of primary roads, secondary roads, and narrow local roads, tracks and trails, and lists the names of some roads. It was created in 2010 after the earthquake. The data was mapped at a scale of 1:12,500."
  ],
  "dct_format_s": "Shapefile",
  "dct_identifier_sm": [
    "https://spatial.lib.berkeley.edu/viewpublic/berkeley-s76d73"
  ],
  "dct_publisher_sm": [
    "East View Geospatial"
  ],
  "dct_accessRights_s": "Restricted",
  "dct_subject_sm": [
    "Transportation",
    "Roads",
    "Streets"
  ],
  "dct_title_s": "Roads, Port-au-Prince, Haiti, 2010",
  "dct_issued_s": "2010-04-01",
  "schema_provider_s": "University of California Berkeley",
  "dct_references_s": "{\"http://www.opengis.net/def/serviceType/ogc/wfs\":\"https://geoservices-secure.lib.berkeley.edu/geoserver/wfs\",\"http://www.opengis.net/def/serviceType/ogc/wms\":\"https://geoservices-secure.lib.berkeley.edu/geoserver/wms\",\"http://www.isotc211.org/schemas/2005/gmd/\":\"https://spatial.lib.berkeley.edu/metadata/berkeley-s76d73/iso19139.xml\",\"http://schema.org/downloadUrl\":\"https://spatial.lib.berkeley.edu/UCB/berkeley-s76d73/data.zip\"}",
  "dct_spatial_sm": [
    "Port-au-prince (Haiti)"
  ],
  "gbl_resourceType_sm": [
    "Line data",
    "Vector data"
  ],
  "gbl_wxsIdentifier_s": "s76d73",
  "gbl_mdModified_dt": "2019-01-10T23:34:35.206Z",
  "id": "berkeley-s76d73",
  "locn_geometry": "ENVELOPE(-72.429028, -72.190757, 18.667664, 18.420145)",
  "dcat_bbox": "ENVELOPE(-72.429028, -72.190757, 18.667664, 18.420145)",
  "gbl_indexYear_im": [
    2010
  ],
  "gbl_mdVersion_s": "Aardvark",
  "gbl_resourceClass_sm": [
    "Datasets"
  ]
}
