{
  "dct_title_s": "2016 NYC Geodatabase, ArcGIS Version (jan2016)",
  "dct_alternative_sm": ["baruch_ancestor2"],
  "dct_description_sm": [
    "Geodatabase with documentation download. Referenced as parent. ",
    "The NYC Geodatabase (nyc_gdb) is a resource designed for basic geographic analysis and thematic mapping within the five boroughs of New York City. It contains geographic features and data compiled from several public sources. Subsets of large features like water, greenspace, and public facilities were created and Census geographies like tracts, ZCTAs, and PUMAs were geoprocessed to create land-based boundaries. Census data from the 2010 Census, American Community Survey (ACS), and ZIP Code Business Patterns are stored in tables that can be easily related to geographic features. Transit and public facility point data were gathered from several city agencies and transformed into spatial data that can be used for reference or analysis for measuring distance, drawing buffers, or counting features within areas. The data is provided in ESRI Geodatabase format."
  ],
  "dct_language_sm": ["eng"],
  "dct_creator_sm": ["GIS Lab, Newman Library, Baruch CUNY"],
  "dct_publisher_sm": ["Newman Library (Bernard M. Baruch College)"],
  "schema_provider_s": "Baruch CUNY",
  "gbl_resourceClass_sm": ["Datasets"],
  "gbl_resourceType_sm": ["Mixed data"],
  "dct_subject_sm": ["Boroughs", "Counties"],
  "dcat_theme_sm": ["Boundaries"],
  "dcat_keyword_sm": ["GBL Fixture records"],
  "dct_temporal_sm": ["2010, 2016"],
  "dct_issued_s": "2016-01-15",
  "gbl_indexYear_im": [2010],
  "gbl_dateRange_drsim": ["[2010 TO 2016]"],
  "dct_spatial_sm": [
    "New York, New York",
    "Bronx County, New York",
    "Kings County, New York",
    "New York County, New York",
    "Queens County, New York",
    "Richmond County, New York",
    "Borough of Bronx, New York",
    "Borough of Brooklyn, New York",
    "Borough of Manhattan, New York",
    "Borough of Queens, New York",
    "Borough of Staten Island, New York"
  ],
  "locn_geometry": "ENVELOPE(-74.255895,-73.700272,40.915282,40.495929)",
  "dcat_bbox": "ENVELOPE(-74.255895,-73.700272,40.915282,40.495929)",
  "dcat_centroid": "40.7056055,-73.9780835",
  "dct_accessRights_s": "Public",
  "dct_format_s": "Geodatabase",
  "gbl_wxsIdentifier_s": "sdr:nyu_2451_34636",
  "dct_references_s": "{\"http://lccn.loc.gov/sh85035852\":\"https://archive.nyu.edu/retrieve/74857/nyu_2451_34636_doc.zip\",\"http://schema.org/downloadUrl\":\"https://archive.nyu.edu/retrieve/74856/nyu_2451_34636.zip\",\"http://schema.org/url\":\"http://hdl.handle.net/2451/34636\"}",
  "id": "nyu_2451_34636",
  "dct_identifier_sm": ["http://hdl.handle.net/2451/34636"],
  "gbl_mdModified_dt": "2021-06-01T22:14:15Z",
  "gbl_mdVersion_s": "Aardvark"
}
