{
  "dct_title_s": "ASTER Global Emissivity Dataset 1-kilometer V003 - AG1KM",
  "dct_alternative_sm": ["no_spatial"],
  "dct_description_sm": [
    "File without geometry type or locn_geometry (will cause error). ",
    "The Advanced Spaceborne Thermal Emission and Reflection radiometer Global Emissivity Database (ASTER GED) was developed by the National Aeronautics and Space Administration's (NASA) Jet Propulsion Laboratory (JPL), California Institute of Technology. The North America portion of this collection was formerly called the North American ASTER Land Surface Emissivity Database (NAALSED) - a seasonal dataset consisting of mean summer (J-A-S) and winter (J-F-M) products. ASTER GED products are output on 1degree x 1 degree grids at 100-meter or 1-kilometer spatial resolution (nominal) and include the mean emissivity and standard deviation for all 5 ASTER thermal infrared bands, mean land surface temperature (LST) and standard deviation, a re-sampled ASTER GDEM (not included in the North America Winter products), land-water mask, mean Normalized Difference Vegetation Index (NDVI) and standard deviation, latitude, longitude, and observation count. Additional ASTER GED product information is available at https://lpdaac.usgs.gov/products/community_products_table. Product tiles are available in HDF and binary format and may be downloaded via HTTP by visiting the following data clients: NASA Reverb (http://reverb.echo.nasa.gov), LP DAAC Data Pool (http://e4ftl01.cr.usgs.gov/ASTT/), or EarthExplorer (http://earthexplorer.usgs.gov)."
  ],
  "schema_provider_s": "U.S. Geological Survey, Department of the Interior",
  "gbl_resourceClass_sm": ["Imagery"],
  "dct_subject_sm": [
    "Land surface temperature",
    "U.S. Geological survey (USGS)",
    "Earth observing system",
    "Land processes distributed active archive center (LPDAAC)",
    "Aster",
    "Normalized difference vegetation index",
    "Terra",
    "Image map",
    "Emissivity"
  ],
  "dcat_keyword_sm": ["GBL Fixture records"],
  "dct_accessRights_s": "Public",
  "dct_references_s": "{}",
  "id": "aster-global-emissivity-dataset-1-kilometer-v003-ag1kmcad20",
  "dct_identifier_sm": ["c0515c4e-97dc-4fff-82cb-f65144482631"],
  "gbl_mdModified_dt": "2021-06-01T22:14:16Z",
  "gbl_mdVersion_s": "Aardvark"
}
