{
  "dct_title_s": "1:1 500 000 series [cartographic material] : tectonic map of Britain, Ireland and adjacent areas / British Geological Survey ; Geological Survey of Ireland ; Geological Survey of Northern Ireland.",
  "dct_alternative_sm": ["actual-papermap1"],
  "dct_description_sm": [
    "Nondigitized paper map with a link to a library catalog. ",
    "Panel title. Depths shown by isolines. \"Geological map [copyright] NERC 1996.\" Also available on flat sheet. \"Sheet 1\"--on panel. Includes text, notes, organizations\\' logos, and ancillary map of \"Orogenic terranes of Britain, Ireland and surrounding seas.\""
  ],
  "dct_language_sm": ["eng"],
  "dct_publisher_sm": ["British Geological Survey"],
  "schema_provider_s": "MIT",
  "gbl_resourceClass_sm": ["Maps"],
  "dcat_keyword_sm": ["Paper map", "GBL Fixture records"],
  "dct_temporal_sm": ["1996"],
  "dct_issued_s": "1905-06-22",
  "gbl_indexYear_im": [1996],
  "gbl_dateRange_drsim": ["[1996 TO 1996]"],
  "locn_geometry": "ENVELOPE(-13,4,62,49)",
  "dcat_bbox": "ENVELOPE(-13,4,62,49)",
  "dcat_centroid": "55.5,-4.5",
  "dct_accessRights_s": "Public",
  "dct_format_s": "Paper",
  "gbl_wxsIdentifier_s": "MIT:001145244",
  "dct_references_s": "{\"http://schema.org/url\":\"http://library.mit.edu/item/001145244\"}",
  "id": "mit-001145244",
  "dct_identifier_sm": ["urn:arrowsmith.mit.edu:MIT.001145244"],
  "gbl_mdModified_dt": "2021-06-11T18:30:23Z",
  "gbl_mdVersion_s": "Aardvark"
}
